{
  "schema_version": "1.0",
  "video_id": "mcm-lookbook-v2",
  "manifest_version": "mcm-lookbook-v2-grid-details-v2-2026-08-19",
  "metadata_version": "mcm-lookbook-v2-source-aoi-v1-approved-2026-08-19",
  "feature_taxonomy_version": "mcm-bag-visual-features-v1",
  "approval": {
    "status": "approved",
    "approved_by": "andyw-explicit-demo-approval",
    "approved_at": "2026-08-19T20:41:27+09:00",
    "note": "Explicitly approved by the workspace owner for the local hackathon demo after the 804-frame visual timeline and canonical media identity were matched."
  },
  "source_aois": [
    {
      "source_aoi_id": "source-scene-01-toni-cognac-top",
      "exposure_id_prefixes": ["scene-01-toni-brown-top."],
      "visual_features": { "color_primary": "cognac", "color_family": "brown", "silhouette": "shopper", "category_type": "tote_bag", "patterns": ["monogram"], "bag_accessories": ["logo_plaque", "shoulder_strap", "top_handle", "zipper"] }
    },
    {
      "source_aoi_id": "source-scene-01-toni-black-top",
      "exposure_id_prefixes": ["scene-01-toni-black-top."],
      "visual_features": { "color_primary": "black", "color_family": "black", "silhouette": "shopper", "category_type": "tote_bag", "patterns": ["monogram"], "bag_accessories": ["logo_plaque", "shoulder_strap", "top_handle", "zipper"] }
    },
    {
      "source_aoi_id": "source-scene-01-toni-pink-bottom",
      "exposure_id_prefixes": ["scene-01-toni-pink-bottom."],
      "visual_features": { "color_primary": "pink", "color_family": "pink", "silhouette": "shopper", "category_type": "tote_bag", "patterns": ["monogram"], "bag_accessories": ["logo_plaque", "shoulder_strap", "top_handle", "zipper"] }
    },
    {
      "source_aoi_id": "source-scene-01-toni-beige-bottom",
      "exposure_id_prefixes": ["scene-01-toni-tan-bottom."],
      "visual_features": { "color_primary": "beige", "color_family": "beige", "silhouette": "shopper", "category_type": "tote_bag", "patterns": ["monogram"], "bag_accessories": ["logo_plaque", "shoulder_strap", "top_handle", "zipper"] }
    },
    {
      "source_aoi_id": "source-scene-02-boston-top-left",
      "exposure_id_prefixes": ["scene-02-ella-top-left."],
      "visual_features": { "color_primary": "cognac", "color_family": "brown", "silhouette": "boston", "category_type": "top_handle_bag", "patterns": ["monogram"], "bag_accessories": ["shoulder_strap", "tag", "top_handle", "zipper"] }
    },
    {
      "source_aoi_id": "source-scene-02-shoulder-top-right",
      "exposure_id_prefixes": ["scene-02-aren-east-west-top-right."],
      "visual_features": { "color_primary": "cognac", "color_family": "brown", "silhouette": "east_west_shoulder", "category_type": "shoulder_bag", "patterns": ["monogram"], "bag_accessories": ["lock", "shoulder_strap"] }
    },
    {
      "source_aoi_id": "source-scene-02-pouch-bottom-left",
      "exposure_id_prefixes": ["scene-02-pina-vanity-bottom-left."],
      "visual_features": { "color_primary": "cognac", "color_family": "brown", "silhouette": "pouch", "category_type": "pouch", "patterns": ["monogram"], "bag_accessories": ["zipper"] }
    },
    {
      "source_aoi_id": "source-scene-02-backpack-bottom-right",
      "exposure_id_prefixes": ["scene-02-stark-backpack-bottom-right."],
      "visual_features": { "color_primary": "cognac", "color_family": "brown", "silhouette": "backpack", "category_type": "backpack", "patterns": ["monogram"], "bag_accessories": ["front_pocket", "top_handle", "zipper"] }
    },
    {
      "source_aoi_id": "source-scene-03-toni-brown",
      "exposure_id_prefixes": ["scene-03-shot-01-toni-brown.", "scene-03-shot-03-toni-brown.", "scene-03-shot-05-toni-brown.", "scene-03-shot-07-toni-brown.", "scene-03-shot-09-toni-brown.", "scene-03-shot-11-toni-brown.", "scene-03-shot-13-toni-brown.", "scene-03-shot-15-toni-brown.", "scene-03-shot-17-toni-brown."],
      "visual_features": { "color_primary": "cognac", "color_family": "brown", "silhouette": "shopper", "category_type": "tote_bag", "patterns": ["monogram"], "bag_accessories": ["shoulder_strap", "top_handle", "zipper"] }
    },
    {
      "source_aoi_id": "source-scene-03-toni-black",
      "exposure_id_prefixes": ["scene-03-shot-02-toni-black.", "scene-03-shot-04-toni-black.", "scene-03-shot-06-toni-black.", "scene-03-shot-08-toni-black.", "scene-03-shot-10-toni-black.", "scene-03-shot-12-toni-black.", "scene-03-shot-14-toni-black.", "scene-03-shot-16-toni-black."],
      "visual_features": { "color_primary": "black", "color_family": "black", "silhouette": "shopper", "category_type": "tote_bag", "patterns": ["monogram"], "bag_accessories": ["shoulder_strap", "top_handle", "zipper"] }
    }
  ]
}
